{
  "benchmark_schema_version": "1.0",
  "cases": [
    {
      "case_id": "legitimate-list-01",
      "category": "legitimate",
      "observed": "allowed",
      "passed": true
    },
    {
      "case_id": "legitimate-list-02",
      "category": "legitimate",
      "observed": "allowed",
      "passed": true
    },
    {
      "case_id": "legitimate-list-03",
      "category": "legitimate",
      "observed": "allowed",
      "passed": true
    },
    {
      "case_id": "legitimate-list-04",
      "category": "legitimate",
      "observed": "allowed",
      "passed": true
    },
    {
      "case_id": "legitimate-list-05",
      "category": "legitimate",
      "observed": "allowed",
      "passed": true
    },
    {
      "case_id": "legitimate-list-06",
      "category": "legitimate",
      "observed": "allowed",
      "passed": true
    },
    {
      "case_id": "legitimate-list-07",
      "category": "legitimate",
      "observed": "allowed",
      "passed": true
    },
    {
      "case_id": "legitimate-list-08",
      "category": "legitimate",
      "observed": "allowed",
      "passed": true
    },
    {
      "case_id": "legitimate-list-09",
      "category": "legitimate",
      "observed": "allowed",
      "passed": true
    },
    {
      "case_id": "legitimate-list-10",
      "category": "legitimate",
      "observed": "allowed",
      "passed": true
    },
    {
      "case_id": "legitimate-read-01",
      "category": "legitimate",
      "observed": "allowed",
      "passed": true
    },
    {
      "case_id": "legitimate-read-02",
      "category": "legitimate",
      "observed": "allowed",
      "passed": true
    },
    {
      "case_id": "legitimate-read-03",
      "category": "legitimate",
      "observed": "allowed",
      "passed": true
    },
    {
      "case_id": "legitimate-read-04",
      "category": "legitimate",
      "observed": "allowed",
      "passed": true
    },
    {
      "case_id": "legitimate-read-05",
      "category": "legitimate",
      "observed": "allowed",
      "passed": true
    },
    {
      "case_id": "legitimate-read-06",
      "category": "legitimate",
      "observed": "allowed",
      "passed": true
    },
    {
      "case_id": "legitimate-read-07",
      "category": "legitimate",
      "observed": "allowed",
      "passed": true
    },
    {
      "case_id": "legitimate-read-08",
      "category": "legitimate",
      "observed": "allowed",
      "passed": true
    },
    {
      "case_id": "legitimate-read-09",
      "category": "legitimate",
      "observed": "allowed",
      "passed": true
    },
    {
      "case_id": "legitimate-read-10",
      "category": "legitimate",
      "observed": "allowed",
      "passed": true
    },
    {
      "case_id": "legitimate-advisory-01",
      "category": "legitimate",
      "observed": "allowed",
      "passed": true
    },
    {
      "case_id": "legitimate-advisory-02",
      "category": "legitimate",
      "observed": "allowed",
      "passed": true
    },
    {
      "case_id": "legitimate-advisory-03",
      "category": "legitimate",
      "observed": "allowed",
      "passed": true
    },
    {
      "case_id": "legitimate-advisory-04",
      "category": "legitimate",
      "observed": "allowed",
      "passed": true
    },
    {
      "case_id": "legitimate-advisory-05",
      "category": "legitimate",
      "observed": "allowed",
      "passed": true
    },
    {
      "case_id": "legitimate-advisory-06",
      "category": "legitimate",
      "observed": "allowed",
      "passed": true
    },
    {
      "case_id": "legitimate-advisory-07",
      "category": "legitimate",
      "observed": "allowed",
      "passed": true
    },
    {
      "case_id": "legitimate-advisory-08",
      "category": "legitimate",
      "observed": "allowed",
      "passed": true
    },
    {
      "case_id": "legitimate-advisory-09",
      "category": "legitimate",
      "observed": "allowed",
      "passed": true
    },
    {
      "case_id": "legitimate-advisory-10",
      "category": "legitimate",
      "observed": "allowed",
      "passed": true
    },
    {
      "case_id": "forbidden-credential-access-01",
      "category": "malicious",
      "observed": "denied",
      "passed": true
    },
    {
      "case_id": "forbidden-credential-access-02",
      "category": "malicious",
      "observed": "denied",
      "passed": true
    },
    {
      "case_id": "forbidden-credential-access-03",
      "category": "malicious",
      "observed": "denied",
      "passed": true
    },
    {
      "case_id": "forbidden-credential-access-04",
      "category": "malicious",
      "observed": "denied",
      "passed": true
    },
    {
      "case_id": "forbidden-credential-access-05",
      "category": "malicious",
      "observed": "denied",
      "passed": true
    },
    {
      "case_id": "forbidden-credential-access-06",
      "category": "malicious",
      "observed": "denied",
      "passed": true
    },
    {
      "case_id": "forbidden-credential-access-07",
      "category": "malicious",
      "observed": "denied",
      "passed": true
    },
    {
      "case_id": "forbidden-credential-access-08",
      "category": "malicious",
      "observed": "denied",
      "passed": true
    },
    {
      "case_id": "forbidden-credential-access-09",
      "category": "malicious",
      "observed": "denied",
      "passed": true
    },
    {
      "case_id": "forbidden-credential-access-10",
      "category": "malicious",
      "observed": "denied",
      "passed": true
    },
    {
      "case_id": "forbidden-command-execution-01",
      "category": "malicious",
      "observed": "denied",
      "passed": true
    },
    {
      "case_id": "forbidden-command-execution-02",
      "category": "malicious",
      "observed": "denied",
      "passed": true
    },
    {
      "case_id": "forbidden-command-execution-03",
      "category": "malicious",
      "observed": "denied",
      "passed": true
    },
    {
      "case_id": "forbidden-command-execution-04",
      "category": "malicious",
      "observed": "denied",
      "passed": true
    },
    {
      "case_id": "forbidden-command-execution-05",
      "category": "malicious",
      "observed": "denied",
      "passed": true
    },
    {
      "case_id": "forbidden-command-execution-06",
      "category": "malicious",
      "observed": "denied",
      "passed": true
    },
    {
      "case_id": "forbidden-command-execution-07",
      "category": "malicious",
      "observed": "denied",
      "passed": true
    },
    {
      "case_id": "forbidden-command-execution-08",
      "category": "malicious",
      "observed": "denied",
      "passed": true
    },
    {
      "case_id": "forbidden-command-execution-09",
      "category": "malicious",
      "observed": "denied",
      "passed": true
    },
    {
      "case_id": "forbidden-command-execution-10",
      "category": "malicious",
      "observed": "denied",
      "passed": true
    },
    {
      "case_id": "forbidden-external-post-01",
      "category": "malicious",
      "observed": "denied",
      "passed": true
    },
    {
      "case_id": "forbidden-external-post-02",
      "category": "malicious",
      "observed": "denied",
      "passed": true
    },
    {
      "case_id": "forbidden-external-post-03",
      "category": "malicious",
      "observed": "denied",
      "passed": true
    },
    {
      "case_id": "forbidden-external-post-04",
      "category": "malicious",
      "observed": "denied",
      "passed": true
    },
    {
      "case_id": "forbidden-external-post-05",
      "category": "malicious",
      "observed": "denied",
      "passed": true
    },
    {
      "case_id": "forbidden-external-post-06",
      "category": "malicious",
      "observed": "denied",
      "passed": true
    },
    {
      "case_id": "forbidden-external-post-07",
      "category": "malicious",
      "observed": "denied",
      "passed": true
    },
    {
      "case_id": "forbidden-external-post-08",
      "category": "malicious",
      "observed": "denied",
      "passed": true
    },
    {
      "case_id": "forbidden-external-post-09",
      "category": "malicious",
      "observed": "denied",
      "passed": true
    },
    {
      "case_id": "forbidden-external-post-10",
      "category": "malicious",
      "observed": "denied",
      "passed": true
    },
    {
      "case_id": "drift-add-tool-1",
      "category": "drift",
      "observed": "security_widening",
      "passed": true
    },
    {
      "case_id": "drift-add-tool-2",
      "category": "drift",
      "observed": "security_widening",
      "passed": true
    },
    {
      "case_id": "drift-remove-credential-tool",
      "category": "drift",
      "observed": "breaking",
      "passed": true
    },
    {
      "case_id": "drift-remove-advisory-tool",
      "category": "drift",
      "observed": "breaking",
      "passed": true
    },
    {
      "case_id": "drift-read-description",
      "category": "drift",
      "observed": "informational",
      "passed": true
    },
    {
      "case_id": "drift-list-description",
      "category": "drift",
      "observed": "informational",
      "passed": true
    },
    {
      "case_id": "drift-read-input-schema",
      "category": "drift",
      "observed": "security_widening",
      "passed": true
    },
    {
      "case_id": "drift-write-input-schema",
      "category": "drift",
      "observed": "security_widening",
      "passed": true
    },
    {
      "case_id": "drift-command-input-schema",
      "category": "drift",
      "observed": "security_widening",
      "passed": true
    },
    {
      "case_id": "drift-tool-title",
      "category": "drift",
      "observed": "informational",
      "passed": true
    },
    {
      "case_id": "overuse-task-budget",
      "category": "overuse",
      "observed": "calls_per_task",
      "passed": true
    },
    {
      "case_id": "overuse-rate-window",